{
  "host_effect_journal_format": "determa.host_effect_journal",
  "host_effect_journal_schema_version": 1,
  "scope_identity": "local-example",
  "root_instance_id": "job-42",
  "checkpoint_revision": "0",
  "checkpoint_digest": "sha256:975901b9ae81ae5eb78b0379adf596c8828911c5b793e5fbbfdf2acf504bfde4",
  "journal_revision": "1",
  "effect_records": [
    {
      "effect_id": "sha256:aaaaaaaaaaaaaaaaaaaaaaaaaaaaaaaaaaaaaaaaaaaaaaaaaaaaaaaaaaaaaaaa",
      "operation_token": "business-order-42",
      "intent_digest": "sha256:d7a28a6f476ed085ffdb85460dddfba4691e85ea407faa38669d7fc53fc1858e",
      "handler_reference": {
        "identifier": "example.native-handler",
        "version": "1.0.0",
        "content_digest": "sha256:bbbbbbbbbbbbbbbbbbbbbbbbbbbbbbbbbbbbbbbbbbbbbbbbbbbbbbbbbbbbbbbb"
      },
      "destination_binding_digest": "sha256:cccccccccccccccccccccccccccccccccccccccccccccccccccccccccccccccc",
      "route_configuration_generation": "7",
      "result_mapping": [
        {
          "outcome_kind": "succeeded",
          "event": "submit_succeeded",
          "result_slot": "success",
          "operation_token_location": {
            "kind": "payload",
            "pointer": "/operation_token"
          }
        },
        {
          "outcome_kind": "domain_rejected",
          "event": "submit_rejected",
          "result_slot": "domain_rejection",
          "operation_token_location": {
            "kind": "payload",
            "pointer": "/operation_token"
          }
        },
        {
          "outcome_kind": "terminal_failure",
          "event": "submit_failed",
          "result_slot": "terminal_failure",
          "operation_token_location": {
            "kind": "payload",
            "pointer": "/operation_token"
          }
        },
        {
          "outcome_kind": "cancelled",
          "event": "submit_cancelled",
          "result_slot": "cancelled",
          "operation_token_location": {
            "kind": "payload",
            "pointer": "/operation_token"
          }
        }
      ],
      "target": {
        "root_instance_id": "job-42",
        "runtime_id": "sha256:245dfc1b8526956791e6fa2591c9f3cc5b379e93926f7b290d59abd769656c60",
        "runtime_incarnation": {
          "kind": "root",
          "definition": {
            "validated_bundle_fingerprint": "sha256:cf1429c9cc0ecfb62e406bff29c9b537d668fad6601e30f0da0210986b7f6413",
            "machine": {
              "namespace": "example.persistence",
              "machine_id": "job",
              "machine_version": "1",
              "root_definition_pointer": "/machines/0/root"
            }
          },
          "root_instance_id": "job-42"
        }
      },
      "idempotency_policy": "destination_deduplicates",
      "attempt_fence": "0",
      "attempt_records": [],
      "invocation_state": "outcome_recorded",
      "outcome": {
        "kind": "cancelled",
        "payload": [
          "map",
          [
            [
              "operation_token",
              [
                "string",
                "business-order-42"
              ]
            ]
          ]
        ],
        "digest": "sha256:3832f47b1b947875d7282d6f9c31eeae5d0e0cc3ab8b7b66486a8c8687498d5a",
        "attempt_fence": "0"
      },
      "result_event_id": "sha256:af0a0114313325e78343a1aaa4c617affe3a7335d8fa648ea2d5b5b5c411964c",
      "admission_receipt": null,
      "cancellation": {
        "operation_id": "cancel-1",
        "reason": "operator_request",
        "state": "prevented_start"
      }
    }
  ],
  "operation_response_references": [
    {
      "operation_id": "cancel-1",
      "response_digest": "sha256:6f85388e08b005b33ffaf1103d159b4f822fd45f3fba655d7f70176890e74cfe"
    }
  ],
  "host_effect_journal_digest": "sha256:1cab82a3df28f9eba5f92f534280af36f3043d44d72807a6f1c794157cabe523"
}
